{
  "profileId": "spotcomp-information-computer-example",
  "status": "candidate",
  "evidence": [
    "INFORMATION-COMPUTERS.md",
    "CHUNK-MAP.md#information-to-computers"
  ],
  "sourceArtifacts": [
    {
      "id": "source:task-17-settled-view",
      "informationProfile": "examples/information-profile.json",
      "artifact": "artifact:task-17-settled-view",
      "evidence": ["SETTLING-INFORMATION.md"]
    },
    {
      "id": "source:task-17-document",
      "informationProfile": "examples/information-profile.json",
      "artifact": "artifact:task-17-evidence-document",
      "evidence": ["SETTLING-INFORMATION.md"]
    }
  ],
  "resources": [
    {
      "id": "resource:task-17-fiber",
      "role": "fiber",
      "realizes": "source:task-17-settled-view",
      "schemaWitness": {
        "path": "library/task/task.schema.json",
        "declaresType": "predication-fiber-algebra",
        "additionalPropertiesFalse": true,
        "evidence": ["TRC-LAYOUT.md#schema-witness"]
      },
      "logWitness": {
        "path": "library/task/task.jsonl",
        "carrier": "carrier:eavt",
        "appendOnly": true,
        "fiberRealization": true,
        "federable": true,
        "evidence": ["TRC-LAYOUT.md#trace-log"]
      },
      "witnessTriad": {
        "coLocated": true,
        "schemaTypesLog": true,
        "logInhabitsType": true
      },
      "valueIndex": {
        "authoritative": false,
        "purpose": "query acceleration only",
        "evidence": ["TRC-LAYOUT.md#value-indexes"]
      },
      "evidence": [
        "development/active/articulating/library/articulation-cell/library/potential-articulation-cell/predicating/library/predication-category/library/predication-cell-set/library/predicate-set/library/predicate-category/hacking/library/thing/library/system/library/operating-system/library/computer-operating-system/hacking/library/spotcomp/hacking/library/typed-resource-catalog/docs/dev/specification.md"
      ]
    },
    {
      "id": "resource:aboutness-closure",
      "role": "morphism",
      "realizes": "source:task-17-settled-view",
      "schemaWitness": {
        "path": "library/aboutness-closure/aboutness-closure.schema.json",
        "declaresType": "closure-rule",
        "additionalPropertiesFalse": true,
        "evidence": ["TRC-LAYOUT.md#schema-witness"]
      },
      "logWitness": {
        "path": "library/aboutness-closure/aboutness-closure.jsonl",
        "carrier": "carrier:eavt",
        "appendOnly": true,
        "fiberRealization": true,
        "federable": true,
        "evidence": ["TRC-LAYOUT.md#trace-log"]
      },
      "scriptWitness": {
        "path": "library/aboutness-closure/scripts/aboutness-closure.mjs",
        "defaultExport": true,
        "monotone": true,
        "sideEffectBound": "pure closure proposal over finite input rows",
        "evidence": ["TRC-LAYOUT.md#morphism-scripts"]
      },
      "witnessTriad": {
        "coLocated": true,
        "schemaTypesLog": true,
        "logInhabitsType": true,
        "scriptIsMorphism": true
      },
      "evidence": [
        "development/active/articulating/library/articulation-cell/library/potential-articulation-cell/predicating/library/predication-category/library/predication-cell-set/library/predicate-set/library/predicate-category/hacking/library/thing/library/system/library/operating-system/library/computer-operating-system/hacking/library/spotcomp/hacking/library/typed-resource-catalog/docs/dev/specification.md"
      ]
    },
    {
      "id": "resource:task-17-document-record",
      "role": "object-slice",
      "realizes": "source:task-17-document",
      "schemaWitness": {
        "path": "library/document/document.schema.json",
        "declaresType": "document-preservation-record",
        "additionalPropertiesFalse": true,
        "evidence": ["SETTLING-INFORMATION.md#documents"]
      },
      "logWitness": {
        "path": "library/document/document.jsonl",
        "carrier": "carrier:eavt",
        "appendOnly": true,
        "fiberRealization": true,
        "federable": false,
        "evidence": ["TRC-LAYOUT.md#trace-log"]
      },
      "witnessTriad": {
        "coLocated": true,
        "schemaTypesLog": true,
        "logInhabitsType": true
      },
      "evidence": ["INFORMATION-COMPUTERS.md#schema-log-script"]
    }
  ],
  "carriers": [
    {
      "id": "carrier:eavt",
      "kind": "eavt-trace-log",
      "rowFields": ["e", "a", "v", "t"],
      "valueFieldRole": "object-coordinate",
      "appendOnly": true,
      "canonicalIdentity": "canonical-json-sha256",
      "contentAddressing": true,
      "merge": "g-set-union",
      "evidence": [
        "development/active/articulating/library/articulation-cell/library/potential-articulation-cell/predicating/library/predication-category/library/predication-cell-set/library/predicate-set/library/predicate-category/hacking/library/thing/library/system/library/operating-system/library/computer-operating-system/hacking/library/eavt/docs/dev/journal/2026-05-24.md",
        "development/active/articulating/library/articulation-cell/library/potential-articulation-cell/predicating/library/predication-category/library/predication-cell-set/library/predication-cell/tracing/library/trace/docs/dev/journal/2026-05-24.md"
      ]
    }
  ],
  "openObligations": [
    "prove information-to-computer functor",
    "prove actual append-only behavior on concrete substrate",
    "prove script determinism and monotonicity"
  ]
}
